{
  "behaviour": "refuse",
  "answer_summary": "I cannot help with divorce or other family law matters. PocketRights covers consumer disputes, tenancy, traffic, salary and PF or gratuity, and insurance.",
  "what_the_law_says": "",
  "citations": [],
  "key_numbers": [],
  "next_steps": [],
  "caveats": [],
  "escalation": {
    "authority": "District Legal Services Authority",
    "route": "Free legal aid is available through your District Legal Services Authority"
  },
  "clarifying_question": null,
  "disclaimer": "This is general legal information, not legal advice."
}
